<?xml version="1.0" encoding="UTF-8"?>
<!DOCTYPE file SYSTEM "dtd/file.dtd">
<file>
  <prefix>swd-</prefix>
  <name>out1</name>
  <suffix>.txt</suffix>
  <correlationid>1</correlationid>
  <path>/Users/scott/work</path>
  <correlationiddir>0</correlationiddir>
  <properties>1</properties>
  <timestamp>1</timestamp>
  <timestampformat>yyyy-MM-dd'T'HH:mm:ss.SSSZ</timestampformat>
</file>
